{
  "schema_version": "1.0",
  "binding_id": "auth_login_v2_resource_binding_v1",
  "page_id": "auth_login_v2",
  "page_id_aliases": [],
  "owner_path": "design/pages/account_privacy/Login",
  "authority_version": "V2.1",
  "page_identity_authority": {
    "authority_id": "experience",
    "json_pointer": "/features/11",
    "field_pointer": "/id",
    "expected_value": "auth_login_v2"
  },
  "authority_version_source": {
    "authority_id": "login",
    "json_pointer": "",
    "field_pointer": "/version",
    "expected_value": "V2.1"
  },
  "source_authorities": [
    {
      "authority_id": "experience",
      "path": "design/registry/experience_registry_v1.json",
      "sha256": "05fce37aaaa5157149eab018605b83afc28c300457484b1bf637bf3a36649e24",
      "purpose": "experience"
    },
    {
      "authority_id": "workflow",
      "path": ".github/workflows/design-manager-pages.yml",
      "sha256": "51f8d59ab19dd2a974381991038a2f746a4b30ab73422b1894d2f01df16f7200",
      "purpose": "workflow"
    },
    {
      "authority_id": "w0",
      "path": "design/system_v3/07_Responsive_System/Page_Pipeline_Reuse_Inventory_V1.md",
      "sha256": "38ebfae34c8ab7aa196f1d9967bd1e950eb9025609b2847fd701abf700705b67",
      "purpose": "w0"
    },
    {
      "authority_id": "assetreg",
      "path": "design/system_v3/06_Asset_System/Asset_Registry_V3_FINAL.json",
      "sha256": "6f08c77ed07c3080062ec4f07c091bd15f0b3961d15012eb3ebb0dd8c7d292f9",
      "purpose": "assetreg"
    },
    {
      "authority_id": "bgreg",
      "path": "design/system_v3/08_Background_System/Background_Registry_V3.json",
      "sha256": "fd806869c0ccb4b9788c360d6a6618dcb8c805c2b0cdce077ccc83d0190a0bb9",
      "purpose": "bgreg"
    },
    {
      "authority_id": "login",
      "path": "design/pages/account_privacy/Login/frozen/manifest.json",
      "sha256": "edadb777bd167559774eb251428a7fc15c699333e1ec2c26b81f2795836c008a",
      "purpose": "login"
    },
    {
      "authority_id": "account",
      "path": "design/pages/account_privacy/authority_manifest_v2.json",
      "sha256": "ad35f9da5b1796501057d10ce11e2cebd707344edb49e549a56f4558cb889577",
      "purpose": "account"
    },
    {
      "authority_id": "private_reference_manifest",
      "path": "design/pages/recognition/web/VISUAL_REFERENCE_MANIFEST_V1.json",
      "sha256": "d4447f4132c29beb4c7e6b8414fce19b47c57114286c758e36e6866352f5f83d",
      "purpose": "Pinned private visual filename/SHA denylist for the final Pages artifact scan."
    },
    {
      "authority_id": "private_photo_mapping",
      "path": "design/pages/recognition/web/contracts/Work_B_Implementation_Mapping_V2.json",
      "sha256": "1a2dce6a4fabd01c122c7bd3c746145234130afc2733521e3d5aed59ceec4f5b",
      "purpose": "Pinned private photo SHA and public publication permissions for the Pages artifact scan."
    },
    {
      "authority_id": "private_input_manifest",
      "path": "design/pages/recognition/web/implementation_input_pack/SWOS_WEB_IMPLEMENTATION_INPUT_MANIFEST_V1.json",
      "sha256": "10bd86f55e41704ca621da8e82568ae6d8ad7a61002d51012ff630bb9b38df4a",
      "purpose": "Pinned private bundle names and SHA values for the actual Pages artifact scan."
    }
  ],
  "publication_policy": {
    "authority_id": "workflow",
    "public_scope_marker": "cp -R design _site/design"
  },
  "page_notes": [
    "The frozen Login V2.1 PNG and original approved-upload metadata have distinct SHA identities and are not substituted for one another.",
    "Footer grass is part of the frozen Login visual; no separate image path is registered."
  ],
  "asset_bindings": [
    {
      "asset_id": "login_v2_1_frozen_final_visual",
      "asset_role": "page_visual_authority_v2_1",
      "source_path": "design/pages/account_privacy/Login/frozen/Login_V2_1_Frozen_Final.png",
      "source_authorities": [
        {
          "authority_id": "login",
          "json_pointer": "",
          "field_map": {
            "source_path": "/visual_authority",
            "lifecycle_status": "/status"
          }
        },
        {
          "authority_id": "login",
          "json_pointer": "/design_manager_preview",
          "field_map": {
            "source_path": "/path"
          }
        },
        {
          "authority_id": "account",
          "json_pointer": "/flows/0/visual_references/0",
          "field_map": {
            "source_path": "/path",
            "sha256": "/sha256",
            "bytes": "/bytes",
            "pixel_dimensions.width": "/width",
            "pixel_dimensions.height": "/height",
            "lifecycle_status": "/status"
          }
        },
        {
          "authority_id": "assetreg",
          "json_pointer": "/entries/25",
          "field_map": {
            "source_path": "/path",
            "sha256": "/sha256",
            "bytes": "/size",
            "lifecycle_status": "/status"
          }
        }
      ],
      "media_type": "image/png",
      "bytes": 1152035,
      "sha256": "c9323f11a9d935f8e98b95276a73930b549b20262eddb5a57968a10835c7486e",
      "pixel_dimensions": {
        "width": 864,
        "height": 1536
      },
      "coordinate_space": "canvas_px 864x1536",
      "fit_crop_policy": "Direct visual authority; no reconstruction or source-byte rewrite",
      "lifecycle_status": "FROZEN",
      "asset_designation": "REFERENCE_ONLY",
      "publication_permission": {
        "state": "PUBLIC_BY_EXISTING_PAGES_RULE",
        "authority_id": "workflow",
        "scope": "Existing Pages rule includes Login V2.1 frozen Design Manager preview.",
        "policy_marker": "cp -R design _site/design"
      },
      "requiredness": "REQUIRED",
      "notes": [
        "Current repository PNG SHA is tied to Asset Registry and Account authority."
      ],
      "page_id": "auth_login_v2"
    },
    {
      "asset_id": "morning_lake_master_bg_content",
      "asset_role": "background_bg_content",
      "source_path": "design/system/backgrounds/morning_lake_v1/assets/Morning_Lake_Master_V1.png",
      "source_authorities": [
        {
          "authority_id": "bgreg",
          "json_pointer": "/backgrounds/1",
          "field_map": {
            "source_path": "/master_path",
            "sha256": "/sha256",
            "lifecycle_status": "/status"
          }
        },
        {
          "authority_id": "login",
          "json_pointer": "/shared_background"
        },
        {
          "authority_id": "assetreg",
          "json_pointer": "/entries/458",
          "field_map": {
            "source_path": "/path",
            "sha256": "/sha256",
            "bytes": "/size",
            "lifecycle_status": "/status"
          }
        }
      ],
      "media_type": "image/png",
      "bytes": 2255291,
      "sha256": "5fba741088ea186e898cd3bee5777e35978436f427492e6e6122528ef6aa91d7",
      "pixel_dimensions": {
        "width": 941,
        "height": 1672
      },
      "coordinate_space": "master_canvas_px 941x1672",
      "fit_crop_policy": null,
      "lifecycle_status": "FROZEN",
      "asset_designation": "ORIGINAL",
      "publication_permission": {
        "state": "PUBLIC_BY_EXISTING_PAGES_RULE",
        "authority_id": "workflow",
        "scope": "Background Registry explicitly includes auth_login_v2 in BG_CONTENT allowed pages.",
        "policy_marker": "cp -R design _site/design"
      },
      "requiredness": "REQUIRED",
      "notes": [
        "Background identity is shared; Login retains its own white transition and page layout."
      ],
      "page_id": "auth_login_v2"
    },
    {
      "asset_id": "login_v2_1_approved_upload_source",
      "asset_role": "approved_source_metadata_only",
      "source_path": null,
      "source_authorities": [
        {
          "authority_id": "login",
          "json_pointer": "/approved_source",
          "field_map": {
            "declared_source_sha256": "/sha256",
            "pixel_dimensions.width": "/dimensions/0",
            "pixel_dimensions.height": "/dimensions/1"
          }
        }
      ],
      "media_type": null,
      "bytes": null,
      "sha256": null,
      "pixel_dimensions": {
        "width": 864,
        "height": 1536
      },
      "coordinate_space": null,
      "fit_crop_policy": null,
      "lifecycle_status": "MISSING",
      "asset_designation": "ORIGINAL",
      "publication_permission": {
        "state": "NOT_CONFIRMED",
        "authority_id": "login",
        "scope": "The original uploaded source is identified by filename/SHA/dimensions but is not in the repository and carries no publication grant.",
        "reason": "Publication rights for the original source are not stated."
      },
      "requiredness": "OPTIONAL",
      "missing_reason": "Approved source upload is absent; no repository path, MIME or byte count is registered.",
      "declared_source_sha256": "2d338ae93153339f96d8d06759f4676ca9ee9df83a071375ed537683b6ce114c",
      "notes": [
        "Original source SHA differs from the frozen repository visual SHA; the two identities stay separate.",
        "No MIME type or path is inferred from filename."
      ],
      "degradation_policy": "Repository frozen Login_V2_1_Frozen_Final.png remains active; do not substitute missing upload source.",
      "page_id": "auth_login_v2"
    },
    {
      "asset_id": "login_footer_grass_semantic",
      "asset_role": "footer_semantic_decoration",
      "source_path": null,
      "source_authorities": [
        {
          "authority_id": "login",
          "json_pointer": "/footer_decoration"
        }
      ],
      "media_type": null,
      "bytes": null,
      "sha256": null,
      "pixel_dimensions": null,
      "coordinate_space": null,
      "fit_crop_policy": null,
      "lifecycle_status": "NOT_VERIFIED",
      "asset_designation": "NOT_APPLICABLE",
      "publication_permission": {
        "state": "NOT_IN_PAGES_SCOPE",
        "authority_id": "login",